,0
96,Single good looking HIV +  BBW looking for my prince in SWM no games or hidden agenda lets chat and see where things go. Will explain more and get to know each each other. I am looking a cmmited relationship but not necessarily marriage.   We can see what works for both of us.  If you're interested please reply with Photo age and your current situation/ relationship inheading to KHADIJA and get a reply from me. No random hook ups or one night stands please
97,"I'm from Kuwait, I live in NY now. I'm an immigrant here and i'm super lucky to be welcomed and have respect, America saved my country once, and respected me here, I am honored and proud to be here. In my wildest dreams I wish to bring an American Army man and introduce him to my mother and sister. They visit often and I would like to have this opportunity. 

My dad was a POW and you guys freed him. He wasn't a good man and he also never gave my mom an orgasm in her life so I guess I hope an American Army man would be able to do that at some point and put him in his place and make her happy for once."
98,"non fiction writer seeks a similar minded writer..being good looking, slim, and mentally secure lol.. are not sources of attraction to me...I like and enjoy imperfections and sharing baggage...(it gets lighter when you share it).  I like men around my age...non-smokers."
99,"Online dating profile consultant available for all of your dating needs. For more info please email me back,"
